UC1:

 CREATE DATABASE address_book_service;
Query OK, 1 row affected (0.12 sec)

mysql> show databases;
+----------------------+
| Database             |
+----------------------+
| address_book_service |
| information_schema   |
| mysql                |
| payroll_service      |
| performance_schema   |
| sys                  |
+----------------------+
6 rows in set (0.10 sec)

mysql> USE address_book_service;
Database changed
mysql> SELECT DATABASE();
+----------------------+
| DATABASE()           |
+----------------------+
| address_book_service |
+----------------------+
1 row in set (0.00 sec)

UC2:
 CREATE TABLE address_book
    -> (
    -> id             int PRIMARY KEY,
    -> first_name     VARCHAR(100)     NOT NULL,
    -> last_name      VARCHAR(100)     NOT NULL,
    -> city           VARCHAR(100)     NOT NULL,
    -> address        VARCHAR(100)     NOT NULL,
    -> state          VARCHAR(100)     NOT NULL,
    -> zip            VARCHAR(100)     NOT NULL,
    -> phone_no       VARCHAR(100)     NOT NULL,
    -> email          VARCHAR(100)     NOT NULL,
    -> type           VARCHAR(100)     NOT NUll
    -> );
Query OK, 0 rows affected (1.90 sec)

mysql> DESCRIBE address_book;
+------------+--------------+------+-----+---------+-------+
| Field      | Type         | Null | Key | Default | Extra |
+------------+--------------+------+-----+---------+-------+
| id         | int          | NO   | PRI | NULL    |       |
| first_name | varchar(100) | NO   |     | NULL    |       |
| last_name  | varchar(100) | NO   |     | NULL    |       |
| city       | varchar(100) | NO   |     | NULL    |       |
| address    | varchar(100) | NO   |     | NULL    |       |
| state      | varchar(100) | NO   |     | NULL    |       |
| zip        | varchar(100) | NO   |     | NULL    |       |
| phone_no   | varchar(100) | NO   |     | NULL    |       |
| email      | varchar(100) | NO   |     | NULL    |       |
| type       | varchar(100) | NO   |     | NULL    |       |
+------------+--------------+------+-----+---------+-------+
10 rows in set (0.06 sec)

UC3:

 INSERT INTO address_book (id,first_name,last_name,city,address,state,zip,phone_no,email,type) VALUES
    -> (1, 'Vaibhav', 'Jagtap', 'Pune', 'Shewalewadi', 'Maharashtra', 412307, 8007815003, 'vai@gmail.com', 'friend'),
    -> (2, 'Suraj', 'Khumbhar', 'Bhosari', 'Dighi', 'Maharashtra', 423113, 7786347438, 'dghsa43@gmail.com', 'friend'),
    -> (3, 'Omkar', 'Gaikwad', 'Mahadevnagar', 'Pune', 'Maharashtra', 412512, 8784576653, 'jasf@gmail.com', 'family');
Query OK, 3 rows affected (0.14 sec)
Records: 3  Duplicates: 0  Warnings: 0

mysql> SELECT * FROM address_book;
+----+------------+-----------+--------------+-------------+-------------+--------+------------+-------------------+--------+
| id | first_name | last_name | city         | address     | state       | zip    | phone_no   | email             | type   |
+----+------------+-----------+--------------+-------------+-------------+--------+------------+-------------------+--------+
|  1 | Vaibhav    | Jagtap    | Pune         | Shewalewadi | Maharashtra | 412307 | 8007815003 | vai@gmail.com     | friend |
|  2 | Suraj      | Khumbhar  | Bhosari      | Dighi       | Maharashtra | 423113 | 7786347438 | dghsa43@gmail.com | friend |
|  3 | Omkar      | Gaikwad   | Mahadevnagar | Pune        | Maharashtra | 412512 | 8784576653 | jasf@gmail.com    | family |
+----+------------+-----------+--------------+-------------+-------------+--------+------------+-------------------+--------+
3 rows in set (0.04 sec)
mysql> INSERT INTO address_book
    -> VALUES(4, 'Darshan', 'Paleriya', 'Pune', 'Yerwada', 'Maharashtra', 443242, 9788464346, 'dsjh@64gmail.com', 'friend');
Query OK, 1 row affected (0.15 sec)

mysql> SELECT * FROM address_book;
+----+------------+-----------+--------------+-------------+-------------+--------+------------+-------------------+--------+
| id | first_name | last_name | city         | address     | state       | zip    | phone_no   | email             | type   |
+----+------------+-----------+--------------+-------------+-------------+--------+------------+-------------------+--------+
|  1 | Vaibhav    | Jagtap    | Pune         | Shewalewadi | Maharashtra | 412307 | 8007815003 | vai@gmail.com     | friend |
|  2 | Suraj      | Khumbhar  | Bhosari      | Dighi       | Maharashtra | 423113 | 7786347438 | dghsa43@gmail.com | friend |
|  3 | Omkar      | Gaikwad   | Mahadevnagar | Pune        | Maharashtra | 412512 | 8784576653 | jasf@gmail.com    | family |
|  4 | Darshan    | Paleriya  | Pune         | Yerwada     | Maharashtra | 443242 | 9788464346 | dsjh@64gmail.com  | friend |
+----+------------+-----------+--------------+-------------+-------------+--------+------------+-------------------+--------+
4 rows in set (0.04 sec)

UC4:

update address_book set first_name = 'Bacchan' where first_name = 'Vaibhav';
Query OK, 1 row affected (0.14 sec)
Rows matched: 1  Changed: 1  Warnings: 0

mysql> SELECT * FROM address_book;
+----+------------+-----------+--------------+-------------+-------------+--------+------------+-------------------+--------+
| id | first_name | last_name | city         | address     | state       | zip    | phone_no   | email             | type   |
+----+------------+-----------+--------------+-------------+-------------+--------+------------+-------------------+--------+
|  1 | Bacchan    | Jagtap    | Pune         | Shewalewadi | Maharashtra | 412307 | 8007815003 | vai@gmail.com     | friend |
|  2 | Suraj      | Khumbhar  | Bhosari      | Dighi       | Maharashtra | 423113 | 7786347438 | dghsa43@gmail.com | friend |
|  3 | Omkar      | Gaikwad   | Mahadevnagar | Pune        | Maharashtra | 412512 | 8784576653 | jasf@gmail.com    | family |
|  4 | Darshan    | Paleriya  | Pune         | Yerwada     | Maharashtra | 443242 | 9788464346 | dsjh@64gmail.com  | friend |
+----+------------+-----------+--------------+-------------+-------------+--------+------------+-------------------+--------+
4 rows in set (0.00 sec)
update address_book set phone_no = 9987987767 where first_name = 'Suraj';
Query OK, 1 row affected (0.12 sec)
Rows matched: 1  Changed: 1  Warnings: 0

mysql> SELECT * FROM address_book;
+----+------------+-----------+--------------+-------------+-------------+--------+------------+-------------------+--------+
| id | first_name | last_name | city         | address     | state       | zip    | phone_no   | email             | type   |
+----+------------+-----------+--------------+-------------+-------------+--------+------------+-------------------+--------+
|  1 | Bacchan    | Jagtap    | Pune         | Shewalewadi | Maharashtra | 412307 | 8007815003 | vai@gmail.com     | friend |
|  2 | Suraj      | Khumbhar  | Bhosari      | Dighi       | Maharashtra | 423113 | 9987987767 | dghsa43@gmail.com | friend |
|  3 | Omkar      | Gaikwad   | Mahadevnagar | Pune        | Maharashtra | 412512 | 8784576653 | jasf@gmail.com    | family |
+----+------------+-----------+--------------+-------------+-------------+--------+------------+-------------------+--------+
3 rows in set (0.03 sec)

UC5:

 SELECT * FROM address_book;
+----+------------+-----------+--------------+-------------+-------------+--------+------------+-------------------+--------+
| id | first_name | last_name | city         | address     | state       | zip    | phone_no   | email             | type   |
+----+------------+-----------+--------------+-------------+-------------+--------+------------+-------------------+--------+
|  1 | Bacchan    | Jagtap    | Pune         | Shewalewadi | Maharashtra | 412307 | 8007815003 | vai@gmail.com     | friend |
|  2 | Suraj      | Khumbhar  | Bhosari      | Dighi       | Maharashtra | 423113 | 7786347438 | dghsa43@gmail.com | friend |
|  3 | Omkar      | Gaikwad   | Mahadevnagar | Pune        | Maharashtra | 412512 | 8784576653 | jasf@gmail.com    | family |
|  4 | Darshan    | Paleriya  | Pune         | Yerwada     | Maharashtra | 443242 | 9788464346 | dsjh@64gmail.com  | friend |
+----+------------+-----------+--------------+-------------+-------------+--------+------------+-------------------+--------+
4 rows in set (0.00 sec)

mysql> DELETE FROM address_book where first_name = 'Darshan';
Query OK, 1 row affected (0.17 sec)

mysql> SELECT * FROM address_book;
+----+------------+-----------+--------------+-------------+-------------+--------+------------+-------------------+--------+
| id | first_name | last_name | city         | address     | state       | zip    | phone_no   | email             | type   |
+----+------------+-----------+--------------+-------------+-------------+--------+------------+-------------------+--------+
|  1 | Bacchan    | Jagtap    | Pune         | Shewalewadi | Maharashtra | 412307 | 8007815003 | vai@gmail.com     | friend |
|  2 | Suraj      | Khumbhar  | Bhosari      | Dighi       | Maharashtra | 423113 | 7786347438 | dghsa43@gmail.com | friend |
|  3 | Omkar      | Gaikwad   | Mahadevnagar | Pune        | Maharashtra | 412512 | 8784576653 | jasf@gmail.com    | family |
+----+------------+-----------+--------------+-------------+-------------+--------+------------+-------------------+--------+
3 rows in set (0.03 sec)

UC6:

SELECT city,first_name, last_name FROM address_book ORDER BY city;
+--------------+------------+-----------+
| city         | first_name | last_name |
+--------------+------------+-----------+
| Bhosari      | Suraj      | Khumbhar  |
| Mahadevnagar | Omkar      | Gaikwad   |
| Pune         | Bacchan    | Jagtap    |
+--------------+------------+-----------+
3 rows in set (0.00 sec)

mysql> SELECT state,first_name, last_name FROM address_book ORDER BY state;
+-------------+------------+-----------+
| state       | first_name | last_name |
+-------------+------------+-----------+
| Maharashtra | Bacchan    | Jagtap    |
| Maharashtra | Suraj      | Khumbhar  |
| Maharashtra | Omkar      | Gaikwad   |
+-------------+------------+-----------+
3 rows in set (0.00 sec)

UC7:

SELECT city,COUNT(city) FROM address_book;
+------+-------------+
| city | COUNT(city) |
+------+-------------+
| Pune |           3 |
+------+-------------+
1 row in set (0.03 sec)

mysql> SELECT state,COUNT(state) FROM address_book;
+-------------+--------------+
| state       | COUNT(state) |
+-------------+--------------+
| Maharashtra |            3 |
+-------------+--------------+
1 row in set (0.00 sec)
